{
  "version": 0,
  "architecture": "x86_64",
  "status": "governance_defined_implementation_unauthorized",
  "authoritative_sources": {
    "decision": "docs/adr/0018-fixed-user-execution-context-ownership.md",
    "phase_definition": "docs/FIXED_USER_EXECUTION_CONTEXT.md",
    "mapping": "contracts/fixed_user_mapping_foundation.v0.json",
    "privilege_transition": "contracts/bounded_privilege_transition_probe_contract.v0.json",
    "request_boundary": "contracts/fixed_user_request_boundary_contract.v0.json",
    "response_consumption": "contracts/bounded_user_response_consumption_contract.v0.json",
    "status_service": "contracts/fixed_user_runtime_status_service_contract.v0.json",
    "runtime_progression": "contracts/runtime_progression_stages.v0.json"
  },
  "authority": {
    "owner": "ring0",
    "context_count": 1,
    "allocation": "fixed_static",
    "user_accessible": false,
    "user_selectable_identity": false,
    "user_mutable_authority": false,
    "public_abi": false,
    "implementation_authorized": false
  },
  "context": {
    "name": "Fixed_User_Execution_Context",
    "format_version": 1,
    "size_bytes": 128,
    "alignment_bytes": 16,
    "storage_policy": "supervisor_rw_nx_static",
    "fields": [
      {"name": "format_version", "offset": 0, "size": 4, "type": "u32", "authority": "structural", "allowed": "zero only while UNINITIALIZED, otherwise 1", "invalid": "any other value", "initial": 0, "mutation": "set once before READY and retain", "cleared": 1, "evidence": "identifies the governed internal format"},
      {"name": "structure_size", "offset": 4, "size": 4, "type": "u32", "authority": "structural", "allowed": "zero only while UNINITIALIZED, otherwise 128", "invalid": "any other value", "initial": 0, "mutation": "set once before READY and retain", "cleared": 128, "evidence": "proves exact context geometry"},
      {"name": "opaque_identity", "offset": 8, "size": 8, "type": "u64", "authority": "ring0_execution", "allowed": "nonzero only in READY, ACTIVE, or RETURNED", "invalid": "zero while authority is live, pointer-derived, PID, or user-selected", "initial": 0, "mutation": "kernel assigns once before READY", "cleared": 0, "evidence": "correlates one bounded lifecycle without exposing an address"},
      {"name": "lifecycle", "offset": 16, "size": 4, "type": "u32", "authority": "ring0_execution", "allowed": "one declared lifecycle encoding", "invalid": "unknown, skipped, backward, or reused state", "initial": 0, "mutation": "only through the legal transition graph", "cleared": 4, "evidence": "proves lifecycle position"},
      {"name": "reserved_0", "offset": 20, "size": 4, "type": "u32", "authority": "reserved", "allowed": "zero", "invalid": "nonzero", "initial": 0, "mutation": "never", "cleared": 0, "evidence": "proves reserved-zero policy"},
      {"name": "user_code_start", "offset": 24, "size": 8, "type": "u64", "authority": "fixed_binding", "allowed": "accepted fixed user-code virtual start while authority is live", "invalid": "any user-selected or different address", "initial": 0, "mutation": "set before READY and immutable while live", "cleared": 0, "evidence": "binds fixed RX code"},
      {"name": "user_code_size", "offset": 32, "size": 8, "type": "u64", "authority": "fixed_binding", "allowed": "accepted fixed user-code size while authority is live", "invalid": "zero or different size while live", "initial": 0, "mutation": "set before READY and immutable while live", "cleared": 0, "evidence": "bounds fixed RX code"},
      {"name": "user_data_start", "offset": 40, "size": 8, "type": "u64", "authority": "fixed_binding", "allowed": "accepted fixed user-data virtual start while authority is live", "invalid": "any user-selected or different address", "initial": 0, "mutation": "set before READY and immutable while live", "cleared": 0, "evidence": "binds fixed RW-NX data"},
      {"name": "user_data_size", "offset": 48, "size": 8, "type": "u64", "authority": "fixed_binding", "allowed": "accepted fixed user-data size while authority is live", "invalid": "zero or different size while live", "initial": 0, "mutation": "set before READY and immutable while live", "cleared": 0, "evidence": "bounds fixed RW-NX data"},
      {"name": "user_stack_start", "offset": 56, "size": 8, "type": "u64", "authority": "fixed_binding", "allowed": "accepted fixed user-stack virtual start while authority is live", "invalid": "any user-selected or different address", "initial": 0, "mutation": "set before READY and immutable while live", "cleared": 0, "evidence": "binds fixed RW-NX stack"},
      {"name": "user_stack_size", "offset": 64, "size": 8, "type": "u64", "authority": "fixed_binding", "allowed": "accepted fixed user-stack size while authority is live", "invalid": "zero or different size while live", "initial": 0, "mutation": "set before READY and immutable while live", "cleared": 0, "evidence": "bounds fixed RW-NX stack"},
      {"name": "user_stack_top", "offset": 72, "size": 8, "type": "u64", "authority": "fixed_binding", "allowed": "accepted fixed user-stack top while authority is live", "invalid": "any user-selected or different address", "initial": 0, "mutation": "set before READY and immutable while live", "cleared": 0, "evidence": "bounds fixed stack geometry"},
      {"name": "entry_rip", "offset": 80, "size": 8, "type": "u64", "authority": "fixed_binding", "allowed": "accepted fixed Ring3 entry while authority is live", "invalid": "any user-selected or different entry", "initial": 0, "mutation": "set before READY and immutable while live", "cleared": 0, "evidence": "binds fixed entry policy"},
      {"name": "initial_rsp", "offset": 88, "size": 8, "type": "u64", "authority": "fixed_binding", "allowed": "accepted fixed Ring3 RSP while authority is live", "invalid": "any user-selected or different stack pointer", "initial": 0, "mutation": "set before READY and immutable while live", "cleared": 0, "evidence": "binds fixed stack-entry policy"},
      {"name": "user_code_selector", "offset": 96, "size": 4, "type": "u32", "authority": "fixed_binding", "allowed": "accepted user-code selector while authority is live", "invalid": "any other selector", "initial": 0, "mutation": "set before READY and immutable while live", "cleared": 0, "evidence": "binds accepted GDT policy"},
      {"name": "user_data_selector", "offset": 100, "size": 4, "type": "u32", "authority": "fixed_binding", "allowed": "accepted user-data selector while authority is live", "invalid": "any other selector", "initial": 0, "mutation": "set before READY and immutable while live", "cleared": 0, "evidence": "binds accepted GDT policy"},
      {"name": "return_vector", "offset": 104, "size": 4, "type": "u32", "authority": "fixed_binding", "allowed": "accepted int 0x81 vector while authority is live", "invalid": "any other vector", "initial": 0, "mutation": "set before READY and immutable while live", "cleared": 0, "evidence": "binds accepted return gate"},
      {"name": "authorized_transition_budget", "offset": 108, "size": 4, "type": "u32", "authority": "ring0_execution", "allowed": "2 while authority is live", "invalid": "any other value while live", "initial": 0, "mutation": "set before READY and never increased", "cleared": 0, "evidence": "bounds existing user-to-kernel returns"},
      {"name": "observed_transition_count", "offset": 112, "size": 4, "type": "u32", "authority": "ring0_execution", "allowed": "0 through 2 with matching transaction phase", "invalid": "greater than budget or phase mismatch", "initial": 0, "mutation": "Ring0 increments once for each authorized int 0x81 entry", "cleared": 0, "evidence": "records bounded transition use"},
      {"name": "transaction_phase", "offset": 116, "size": 4, "type": "u32", "authority": "ring0_execution", "allowed": "accepted REQUEST_PENDING, RESPONSE_READY, or CONSUMED with matching count", "invalid": "unknown or count-inconsistent phase", "initial": 0, "mutation": "existing Ring0 transaction handlers only", "cleared": 0, "evidence": "associates count with existing transaction authority"},
      {"name": "request_identifier", "offset": 120, "size": 4, "type": "u32", "authority": "fixed_binding", "allowed": "accepted fixed runtime-status request identifier while authority is live", "invalid": "any other or user-selected identifier", "initial": 0, "mutation": "set before READY and immutable while live", "cleared": 0, "evidence": "binds the existing fixed service transaction"},
      {"name": "reserved_1", "offset": 124, "size": 4, "type": "u32", "authority": "reserved", "allowed": "zero", "invalid": "nonzero", "initial": 0, "mutation": "never", "cleared": 0, "evidence": "proves reserved-zero policy"}
    ]
  },
  "lifecycle": {
    "encodings": {
      "UNINITIALIZED": 0,
      "READY": 1,
      "ACTIVE": 2,
      "RETURNED": 3,
      "CLEARED": 4
    },
    "successful_transitions": [
      {"from": "UNINITIALIZED", "to": "READY"},
      {"from": "READY", "to": "ACTIVE"},
      {"from": "ACTIVE", "to": "RETURNED"},
      {"from": "RETURNED", "to": "CLEARED"}
    ],
    "failure_cleanup_transitions": [
      {"from": "READY", "to": "CLEARED"},
      {"from": "ACTIVE", "to": "CLEARED"},
      {"from": "RETURNED", "to": "CLEARED"}
    ],
    "forbidden_transitions": [
      {"from": "UNINITIALIZED", "to": "ACTIVE"},
      {"from": "UNINITIALIZED", "to": "RETURNED"},
      {"from": "READY", "to": "RETURNED"},
      {"from": "ACTIVE", "to": "READY"},
      {"from": "RETURNED", "to": "ACTIVE"},
      {"from": "CLEARED", "to": "ACTIVE"},
      {"from": "CLEARED", "to": "READY"}
    ],
    "pre_ready_failure": "remain_UNINITIALIZED_commit_failure_result_and_do_not_enter_ring3",
    "active_scope": "complete_existing_two_transition_transaction",
    "reuse_allowed": false
  },
  "clear_state": {
    "lifecycle": "CLEARED",
    "retained_structural_fields": {
      "format_version": 1,
      "structure_size": 128
    },
    "zeroized_fields": [
      "opaque_identity",